pid,title,wyvern,ethereal,crone,rotfiend,therazane,grottore
noisome,Impedit eum ipsam corrupti sint rem quia.,"Will this sadness that makes me cry my heart out — will it ever end? The answer, of course, is yes. One day the sadness will end.",Пестов Степан,کامران لنکرانی,Incredible Wool Clock,animi.quae/doloribus.numbers,Nameless unutterable accursed non-euclidean manuscript.
singular,Assumenda hic aperiam corrupti autem iste.,"Where we're from, the birds sing a pretty song, and there's always music in the air.",Никита Дьячков,گلی مجتهدی IV,Synergistic Rubber Knife,necessitatibus-est/consequuntur.txt,Tenebrous singular cat loathsome tentacles immemorial shunned gibbering hideous.
stygian,Quis neque qui mollitia facere alias modi repudiandae odit.,Damn fine coffee! And hot!,Смирнова Регина,گلرو لاهوتی,Enormous Marble Coat,itaque.occaecati/suscipit.xlsx,Unnamable nameless eldritch fungus lurk gibbering.
dank,Et esse neque eum nihil molestiae ipsum consequatur.,There was a fish in the percolator!,Пономарев Арсений Егорович,فرهاد واعظ,Fantastic Silk Shirt,aperiam.repudiandae/expedita.css,Tenebrous swarthy amorphous comprehension ululate hideous blasphemous.
amorphous,Unde laudantium sit nam numquam est.,"Wow, Bob, wow.",Якушева Вера,فرزین قنبری,Mediocre Cotton Lamp,ut-omnis/sint.csv,Manuscript noisome loathsome squamous unmentionable eldritch comprehension.
loathsome,Laudantium nisi sint repellendus consequatur.,There was a fish in the percolator!,Станислав Вячеславович Куликов,هخامنش لاهوتی DDS,Heavy Duty Bronze Chair,est-est/iusto.flac,Unnamable fainted charnel loathsome tenebrous cyclopean.
manuscript,Eius non eum soluta nulla deleniti.,"Where we're from, the birds sing a pretty song, and there's always music in the air.",Матвей Фёдорович Козлов,سامان قمیشی,Rustic Wool Computer,sit_labore/consequatur.odp,Gibbous unmentionable accursed cyclopean stench.
