pid,title,ulfhedinn,cloud_giant,endrega_worker,noonwraith,cyclopse,the_caretaker
blasphemous,Totam voluptas consectetur dolorem est.,"Windom Earle's mind is like a diamond. It's cold, and hard, and brilliant.",Юдин Александр,اوژن کیان,Ergonomic Concrete Car,aliquam.qui/ut.mp4,Charnel lurk cat furtive dank loathsome cyclopean non-euclidean.
stygian,Repellendus distinctio est fuga omnis.,"You know, this is — excuse me — a damn fine cup of coffee!",Фёдор Геннадьевич Кабанов,کامراوا ندوشن,Intelligent Bronze Wallet,saepe_rem/minima.png,Madness eldritch swarthy gambrel indescribable ululate blasphemous charnel.
comprehension,Non ratione doloremque odit dolore nobis expedita maxime dolor.,"Through the darkness of future's past, the magician longs to see. One chants out between two worlds... ""Fire... walk with me.""",Василий Денисович Назаров,مهشاد عبادی,Intelligent Wool Gloves,architecto_eum/qui.ppt,Furtive non-euclidean stygian amorphous abnormal cyclopean dank.
charnel,Et quibusdam tempora nihil.,"Every day, once a day, give yourself a present.",Трофимов Семён Юрьевич,دیااکو ملایری IV,Ergonomic Leather Table,dolore_qui/incidunt.wav,Unmentionable cat gibbering gambrel antediluvian non-euclidean abnormal furtive stench.
loathsome,Ea ad atque autem.,The owls are not what they seem.,Макар Вячеславович Одинцов,گلچین مرتضوی,Intelligent Copper Car,quasi_est/corrupti.ods,Noisome charnel immemorial lurk madness effulgence abnormal swarthy indescribable.
madness,Aut architecto in sed.,"Cooper, you may be fearless in this world, but there are other worlds.",Кононов Семён Вячеславович,گوهر ناز یادگار DVM,Small Paper Knife,quidem.molestiae/laboriosam.css,Squamous gibbous cat tenebrous comprehension charnel stygian.
indescribable,Sunt possimus eligendi et.,"Will this sadness that makes me cry my heart out — will it ever end? The answer, of course, is yes. One day the sadness will end.",Анна Кошелева,خانم کامبخش ناظری,Awesome Marble Lamp,perspiciatis_est/sint.ppt,Unmentionable blasphemous stygian loathsome mortal hideous charnel unutterable noisome.
