pid,title,gael,djinn,griffin,hound_of_the_wild_hunt,kernun,therazane
unutterable,Necessitatibus et omnis doloremque modi occaecati qui veritatis neque.,She's dead... Wrapped in plastic.,Лидия Смирнова,دکتر کوشا لاچینی,Enormous Steel Shoes,quod.eos/consequatur.tiff,Non-euclidean stygian iridescence blasphemous squamous hideous amorphous antediluvian comprehension.
effulgence,Nobis consequuntur iste sunt distinctio nostrum.,MAY A SMILE BE YOUR UMBRELLA. WE'VE ALL HAD OUR SOCKS TOSSED AROUND.,Егор Овчинников,روزبه کمالی,Fantastic Cotton Gloves,recusandae.deserunt/est.mp3,Manuscript lurk stygian spectral.
immemorial,Adipisci architecto eius dolore.,It has been a pleasure speaking to you.,Соколова Лидия Алексеевна,شاهدخت علی عسگری,Sleek Silk Bench,voluptatem-voluptate/quis.ppt,Lurk unmentionable gambrel swarthy squamous madness stygian antediluvian iridescence.
decadent,In sapiente labore quis minus quam dolorem.,"Every day, once a day, give yourself a present.",Клавдия Ярославовна Турова,هور مجتبایی,Small Cotton Coat,omnis_rerum/hic.doc,Antediluvian accursed shunned tentacles antiquarian unmentionable swarthy hideous.
manuscript,Tenetur temporibus ea sed aspernatur.,MAY A SMILE BE YOUR UMBRELLA. WE'VE ALL HAD OUR SOCKS TOSSED AROUND.,Надежда Вадимовна Яковлева,شهرام گلپایگانی,Durable Paper Hat,odio_quos/voluptatum.bmp,Stench non-euclidean iridescence furtive unnamable lurk indescribable nameless abnormal.
gambrel,Optio molestiae sed neque et consequuntur.,"Through the darkness of future's past, the magician longs to see. One chants out between two worlds... ""Fire... walk with me.""",Ольга Гурьева,دکتر هیتاسب کیان,Awesome Bronze Coat,error.beatae/rem.mp3,Fainted loathsome lurk eldritch blasphemous decadent.
stygian,Atque tempora maxime est porro.,J'ai une âme solitaire.,Ольга Блинова,راسپینا عبدالکریمی,Sleek Wool Table,pariatur.possimus/molestias.mov,Gibbous spectral madness loathsome nameless tenebrous shunned comprehension noisome.
